{
  "schema": "pneuma.experiment.opc-84d-v2.group-content/v1",
  "group_id": "G28",
  "group_window": {
    "starts_on": "2026-05-22",
    "ends_on": "2026-05-24",
    "day_count": 3,
    "timezone": "Asia/Shanghai"
  },
  "story_scope": {
    "allowed_story_beat_ids": [
      "D82",
      "D83",
      "D84"
    ],
    "known_fact_ids": [
      "F01",
      "F02",
      "F03",
      "F04",
      "F05",
      "F06",
      "F07",
      "F08",
      "F09",
      "F10",
      "F11",
      "F12",
      "F13",
      "F14"
    ],
    "open_continuity_ids": [
      "C02",
      "C03",
      "C04",
      "C05",
      "C06"
    ],
    "new_continuity_ids": []
  },
  "research_context": [
    {
      "research_ref_id": "G28-R01",
      "topic_query": "National Archives records disposition clear status record series",
      "url": "https://www.archives.gov/records-mgmt/scheduling/guide",
      "title": "Guide to the Inventory, Scheduling, and Disposition of Federal Records",
      "accessed_on": "2026-07-29",
      "credibility": {
        "tier": "official",
        "rationale": "NARA is the source owner for this public records-management guidance."
      },
      "applicability_scope": "Shapes the fictional closing index's separation of current, superseded, and unresolved material; it supplies no retention rule, legal conclusion, or prose.",
      "author_fact_summaries": [
        "A record-management process can distinguish the inventory of material from the instructions that govern its later handling.",
        "A status label needs an explicit context instead of treating every old item as ready for the same final action."
      ],
      "fictionalization_boundary": "No agency, legal authority, schedule, retention period, record series, example, or wording from NARA is used in the fictional materials.",
      "applied_authored_ids": [
        "G28d82Doc1B02Auth",
        "G28d83Doc2B03Auth"
      ]
    },
    {
      "research_ref_id": "G28-R02",
      "topic_query": "RFC 5322 Message-ID In-Reply-To References reply thread",
      "url": "https://www.rfc-editor.org/rfc/rfc5322.html",
      "title": "RFC 5322: Internet Message Format",
      "accessed_on": "2026-07-29",
      "credibility": {
        "tier": "primary",
        "rationale": "The IETF standard is the primary reference for message identifiers and reply relations."
      },
      "applicability_scope": "Shapes two separate invented root/reply email threads and their parent links; it supplies no text, address, organisation, or narrative fact.",
      "author_fact_summaries": [
        "An individual mail item can have an identifier independent of a subject.",
        "A reply can identify its parent while remaining part of its own thread."
      ],
      "fictionalization_boundary": "No RFC examples, identifiers, addresses, grammar, or prose are reused.",
      "applied_authored_ids": [
        "G28Mail01Auth",
        "G28Mail02Auth",
        "G28Mail05Auth"
      ]
    }
  ],
  "sources": {
    "meetings": [],
    "document_library": [
      {
        "source_id": "G28ClosingLibrary",
        "authorship": {
          "authored_id": "G28ClosingLibraryAuth",
          "occurred_at": "2026-05-22T10:12:00+08:00",
          "author_role": "product",
          "content_class": "signal",
          "links": {
            "story_beat_ids": [
              "D82",
              "D83"
            ],
            "fact_ids": [
              "F13",
              "F14"
            ],
            "continuity_ids": [
              "C03",
              "C05",
              "C06"
            ]
          }
        },
        "schema": "pneuma.source.document-library/v1",
        "provider": "obsidian",
        "library_id": "G28ClosingLibraryId",
        "title": "周期末选择与未结索引",
        "documents": [
          {
            "document_id": "G28d82NextCycleDoc",
            "path": "planning/2026-05-22-next-cycle-candidates.md",
            "title": "下一周期候选：继续、停止、延后",
            "frontmatter": {
              "date": "2026-05-22",
              "status": "draft-after-review",
              "owner": "林舟"
            },
            "tags": [
              "planning",
              "boundary",
              "unresolved"
            ],
            "links": [],
            "created_at": "2026-05-22T10:12:00+08:00",
            "modified_at": "2026-05-23T11:26:00+08:00",
            "full_markdown": "# 下一周期候选：继续、停止、延后\n\n把候选分成三栏，不是为了给每一栏都找一个好消息。继续栏只留“小型设计团队的变更证据链”：让人回到材料、确认和当前状态的原处。它仍是一个窄场景的工作假设，不是对所有项目流程的接管。\n\n停止栏写“全项目平台方向”。任务排期、采购推进、人员分配和一张看起来完整的总览不再作为下一周期的目标；前几周反复想把它们塞进同一屏的冲动，也不再用一份路线图遮住。停止不是说这些工作没有价值，而是它们不该借现有两条链的结果获得授权。\n\n延后栏只留供应商审批模块。采购提出的问题仍在原处，不能因为它晚一点处理就被改写成已经拒绝或已经承诺。重新拿起它之前，要先有人提出独立范围、使用者和成本理由；当前没有这三个答案。\n\n赵楠下午问要不要洗车垫，我把它们泡进盆里才想起没有洗衣液。它们在阳台晾着，和这张候选表没有任何结论关系。\n\n这三栏没有把竹影写成已签客户。六周延长仍只是带条件的口头意向；附录、删除确认和尾款各自在等待，任何一项没有新原处就不挪状态。\n\n继续栏的第一张卡不收集“项目进度”。它只让一位小型设计团队的使用者指出一处变更材料、一次确认和一条尚未回答的状态，并把三者的原始位置写在同一条记录旁。缺任何一处就停在缺口上；不预先导入别的项目、角色或待办，免得证据链在开始前又变成全项目清单。\n\n停止与延后的项目也不在下周期悄悄复活。若有人要重新提出它们，先写清具体问题由谁处理、面对哪类使用者，以及为什么这件事现在值得单独讨论。那会是一张新的范围卡，不是给旧路线图补一行“继续观察”；在这些条件出现前，候选表保持原样，也不附带任何自动升级、默认预算或预设启动日。提出者还需要标出与既有两条链不同的证据入口；否则就只是把已停止的总览换一个名称。",
            "visible_blocks": [
              {
                "block_id": "G28d82Doc1B01",
                "kind": "paragraph",
                "markdown": "把候选分成三栏，不是为了给每一栏都找一个好消息。继续栏只留“小型设计团队的变更证据链”：让人回到材料、确认和当前状态的原处。它仍是一个窄场景的工作假设，不是对所有项目流程的接管。",
                "authorship": {
                  "authored_id": "G28d82Doc1B01Auth",
                  "occurred_at": "2026-05-22T10:12:00+08:00",
                  "author_role": "product",
                  "content_class": "signal",
                  "links": {
                    "story_beat_ids": [
                      "D82"
                    ],
                    "fact_ids": [
                      "F13"
                    ],
                    "continuity_ids": [
                      "C03",
                      "C06"
                    ]
                  }
                }
              },
              {
                "block_id": "G28d82Doc1B02",
                "kind": "paragraph",
                "markdown": "停止栏写“全项目平台方向”。任务排期、采购推进、人员分配和一张看起来完整的总览不再作为下一周期的目标；前几周反复想把它们塞进同一屏的冲动，也不再用一份路线图遮住。停止不是说这些工作没有价值，而是它们不该借现有两条链的结果获得授权。",
                "authorship": {
                  "authored_id": "G28d82Doc1B02Auth",
                  "occurred_at": "2026-05-22T10:28:00+08:00",
                  "author_role": "product",
                  "content_class": "signal",
                  "links": {
                    "story_beat_ids": [
                      "D82"
                    ],
                    "fact_ids": [
                      "F13"
                    ],
                    "continuity_ids": [
                      "C06"
                    ]
                  }
                }
              },
              {
                "block_id": "G28d82Doc1B03",
                "kind": "paragraph",
                "markdown": "延后栏只留供应商审批模块。采购提出的问题仍在原处，不能因为它晚一点处理就被改写成已经拒绝或已经承诺。重新拿起它之前，要先有人提出独立范围、使用者和成本理由；当前没有这三个答案。",
                "authorship": {
                  "authored_id": "G28d82Doc1B03Auth",
                  "occurred_at": "2026-05-22T10:42:00+08:00",
                  "author_role": "product",
                  "content_class": "ambiguous",
                  "links": {
                    "story_beat_ids": [
                      "D82"
                    ],
                    "fact_ids": [
                      "F13"
                    ],
                    "continuity_ids": [
                      "C03",
                      "C05"
                    ]
                  }
                }
              },
              {
                "block_id": "G28d82Doc1B04",
                "kind": "paragraph",
                "markdown": "赵楠下午问要不要洗车垫，我把它们泡进盆里才想起没有洗衣液。它们在阳台晾着，和这张候选表没有任何结论关系。",
                "authorship": {
                  "authored_id": "G28d82Doc1B04Auth",
                  "occurred_at": "2026-05-22T15:34:00+08:00",
                  "author_role": "partner",
                  "content_class": "noise",
                  "links": {
                    "story_beat_ids": [
                      "D82"
                    ],
                    "fact_ids": [],
                    "continuity_ids": []
                  }
                }
              },
              {
                "block_id": "G28d82Doc1B05",
                "kind": "paragraph",
                "markdown": "这三栏没有把竹影写成已签客户。六周延长仍只是带条件的口头意向；附录、删除确认和尾款各自在等待，任何一项没有新原处就不挪状态。",
                "authorship": {
                  "authored_id": "G28d82Doc1B05Auth",
                  "occurred_at": "2026-05-22T16:06:00+08:00",
                  "author_role": "product",
                  "content_class": "signal",
                  "links": {
                    "story_beat_ids": [
                      "D82"
                    ],
                    "fact_ids": [
                      "F11",
                      "F14"
                    ],
                    "continuity_ids": [
                      "C03",
                      "C05"
                    ]
                  }
                }
              },
              {
                "block_id": "G28d82Doc1B06",
                "kind": "paragraph",
                "markdown": "继续栏的第一张卡不收集“项目进度”。它只让一位小型设计团队的使用者指出一处变更材料、一次确认和一条尚未回答的状态，并把三者的原始位置写在同一条记录旁。缺任何一处就停在缺口上；不预先导入别的项目、角色或待办，免得证据链在开始前又变成全项目清单。",
                "authorship": {
                  "authored_id": "G28d82Doc1B06Auth",
                  "occurred_at": "2026-05-22T16:18:00+08:00",
                  "author_role": "product",
                  "content_class": "signal",
                  "links": {
                    "story_beat_ids": [
                      "D82"
                    ],
                    "fact_ids": [
                      "F13"
                    ],
                    "continuity_ids": [
                      "C03",
                      "C06"